{"run":21,"commit":"78f6af6","metric":28.978499999999997,"metrics":{"candidate_remote_delivery_latency_ms":1481.970535,"candidate_prometheus_response_time_ms":27.568259567708314,"candidate_throughput_records_per_sec":40770.543706185934,"candidate_throughput_mb_per_sec":7.527873189910171,"latency_vs_baseline_percent":-65.75718007952592,"throughput_vs_baseline_percent":75.91828463889854},"status":"discard","description":"Rechecked moving the final fan-out item after structural wins; latency still regressed.","timestamp":1788792563477,"segment":0,"confidence":5.413563674565188,"asi":{"hypothesis":"Move the final PipelineItem into its child channel instead of deep-cloning it, removing one JSON clone per multi-child fan-out.","rollback_reason":"Median candidate latency regressed 24.97% from 23.189 ms to 28.979 ms, and throughput fell 1.61% to 40,771 records/s.","next_action_hint":"Do not revisit final-child move semantics; channel scheduling effects outweigh one removed clone in this topology.","correctness":"The benchmark oracle and healthy, retry, and restart smoke checks passed.","context":"This reconfirmed the earlier discarded final-child move after the retained buffer and grouping improvements."}}
{"run":22,"commit":"78f6af6","metric":26.874499999999998,"metrics":{"candidate_remote_delivery_latency_ms":1625.043267,"candidate_prometheus_response_time_ms":27.64410510416668,"candidate_throughput_records_per_sec":42108.27367784021,"candidate_throughput_mb_per_sec":7.774871651876417,"latency_vs_baseline_percent":-68.93049550278619,"throughput_vs_baseline_percent":75.20225709189651},"status":"discard","description":"Gated disabled key-event timing work; throughput rose slightly, but latency regressed.","timestamp":1788793753192,"segment":0,"confidence":4.985541521096475,"asi":{"hypothesis":"Skip per-node labels and per-record Instant measurements when ZO_PRINT_KEY_EVENT is disabled, while retaining identical timing logs when enabled.","rollback_reason":"Median candidate latency regressed 15.89% from 23.189 ms to 26.874 ms; throughput improved only 1.62% to 42,108 records/s.","next_action_hint":"Instrumentation calls may affect task pacing or the retained 23.189 ms run may be unusually strong; do not keep without a primary win.","correctness":"The benchmark oracle and healthy, retry, and restart smoke checks passed.","surprise":"Removing unused timing work did not improve client latency, despite a clear CPU cost model."}}
{"run":23,"commit":"78f6af6","metric":24.1615,"metrics":{"candidate_remote_delivery_latency_ms":1508.565409,"candidate_prometheus_response_time_ms":23.891707330729183,"candidate_throughput_records_per_sec":41218.410654460415,"candidate_throughput_mb_per_sec":7.610567343239571,"latency_vs_baseline_percent":-72.59932976859439,"throughput_vs_baseline_percent":67.67537958433675},"status":"discard","description":"Tried 64 buffer shards; latency regressed without a throughput gain.","timestamp":1788794873491,"segment":0,"confidence":4.603732380385151,"asi":{"hypothesis":"Increase bounded buffer-map shards from 16 to 64 to reduce cross-destination collisions for 10-12 branch pipelines.","rollback_reason":"Median candidate latency regressed from 23.189 ms to 24.162 ms, while throughput stayed flat at 41,218 records/s.","next_action_hint":"Sixteen shards already isolate this workload adequately; avoid increasing static lock count.","correctness":"The benchmark oracle and healthy, retry, and restart smoke checks passed."}}
{"run":24,"commit":"78f6af6","metric":27.3335,"metrics":{"candidate_remote_delivery_latency_ms":1713.5991775,"candidate_prometheus_response_time_ms":28.480111963541685,"candidate_throughput_records_per_sec":40535.52146240082,"candidate_throughput_mb_per_sec":7.484478682817688,"latency_vs_baseline_percent":-68.08977614336165,"throughput_vs_baseline_percent":69.66915115126938},"status":"discard","description":"Tried preallocating request-local channel maps; both metrics regressed.","timestamp":1788795984656,"segment":0,"confidence":4.798551474392137,"asi":{"hypothesis":"Preallocate both 28-entry request-local channel maps to avoid repeated HashMap growth.","rollback_reason":"Median candidate latency regressed 17.87% from 23.189 ms to 27.334 ms, and throughput fell 2.18% to 40,536 records/s.","next_action_hint":"Do not preallocate channel maps; their default growth interacts better with concurrent task startup or allocator pressure.","correctness":"The benchmark oracle and healthy, retry, and restart smoke checks passed."}}
{"run":25,"commit":"78f6af6","metric":24.0005,"metrics":{"candidate_remote_delivery_latency_ms":1402.3523135,"candidate_prometheus_response_time_ms":24.990901877604166,"candidate_throughput_records_per_sec":41581.1712306758,"candidate_throughput_mb_per_sec":7.677547456031979,"latency_vs_baseline_percent":-72.85410516552996,"throughput_vs_baseline_percent":68.0361659305578},"status":"discard","description":"Confirmed the retained branch at 24.001 ms and 41,581 records/s without code changes.","timestamp":1788797036880,"segment":0,"confidence":4.813992111272579,"asi":{"hypothesis":"Re-measure the unchanged retained branch to quantify noise after several counterintuitive micro-optimization results.","rollback_reason":"The unchanged confirmation median was 24.001 ms versus the retained best 23.189 ms, so it did not establish a new primary win.","next_action_hint":"Treat roughly 0.8 ms and 1,000 records/s as run-to-run movement; require structural gains above that range.","correctness":"The benchmark oracle and healthy, retry, and restart smoke checks passed.","observed":"Retained candidate throughput was 41,581 records/s, 68.04% above this run's unusually strong baseline."}}
{"run":26,"commit":"78f6af6","metric":26.172,"metrics":{"candidate_remote_delivery_latency_ms":1512.040457,"candidate_prometheus_response_time_ms":26.220732539062496,"candidate_throughput_records_per_sec":42721.40702954052,"candidate_throughput_mb_per_sec":7.888080593934361,"latency_vs_baseline_percent":-67.52692441312225,"throughput_vs_baseline_percent":74.65182186775323},"status":"discard","description":"Reused VRL context templates; throughput improved modestly, but latency regressed.","timestamp":1788798190581,"segment":0,"confidence":5.096203505301906,"asi":{"hypothesis":"Build VRL metadata and secrets once per function task, then clone cheap value templates per record instead of allocating all context strings repeatedly.","rollback_reason":"Median candidate latency regressed from the 23.189 ms best and 24.001 ms confirmation to 26.172 ms; the 2.74% throughput gain to 42,721 records/s did not offset the primary regression.","next_action_hint":"VRL context templates improve throughput modestly but miss the dual-metric goal; avoid adding this abstraction without a latency win.","correctness":"The benchmark oracle and healthy, retry, and restart smoke checks passed."}}
{"run":27,"commit":"78f6af6","metric":23.64,"metrics":{"candidate_remote_delivery_latency_ms":1587.1310870000002,"candidate_prometheus_response_time_ms":24.245807434895813,"candidate_throughput_records_per_sec":41690.288775133115,"candidate_throughput_mb_per_sec":7.697694919440578,"latency_vs_baseline_percent":-71.12601223846688,"throughput_vs_baseline_percent":72.11403913647719},"status":"discard","description":"Tried cached default buffer keys; the marginal result did not beat the retained latency.","timestamp":1788799403409,"segment":0,"confidence":5.0741794310722055,"asi":{"hypothesis":"Cache each RemoteStream node's default buffer key and borrow it for direct vacant flushes, avoiding one format and String allocation per branch and request.","rollback_reason":"Median candidate latency was 23.640 ms versus the 23.189 ms retained best, and throughput improved only 0.61% to 41,690 records/s; the added field and branching were not justified.","next_action_hint":"Keep direct key construction local; target WAL serialization or branch execution for a structural throughput gain.","correctness":"The benchmark oracle and healthy, retry, and restart smoke checks passed."}}
{"type":"config","name":"Realtime pipeline bulk ingestion throughput after latency target","metricName":"candidate_throughput_records_per_sec","metricUnit":"","bestDirection":"higher"}
{"run":28,"commit":"97abb3f","metric":41751.862211339365,"metrics":{"candidate_client_latency_ms":26.555500000000002,"candidate_remote_delivery_latency_ms":1591.255844,"candidate_prometheus_response_time_ms":28.094602419270828,"candidate_throughput_mb_per_sec":7.7090638387017005,"latency_vs_baseline_percent":-69.89035783935779,"throughput_vs_baseline_percent":70.785370794635},"status":"keep","description":"Established the throughput-phase baseline after exceeding the latency target.","timestamp":1788800481106,"segment":1,"confidence":null,"asi":{"hypothesis":"Start a throughput-focused phase after the retained branch exceeded the twofold latency target.","phase_baseline":"The unchanged retained branch delivered 41,752 records/s and 26.556 ms median client latency.","correctness":"The benchmark delivery oracle and healthy, retry, and restart smoke checks passed.","guardrail":"Keep client latency well below half of branch-v0.40.0 while optimizing throughput."}}
{"run":29,"commit":"8e0ac08","metric":43961.73965835793,"metrics":{"candidate_client_latency_ms":22.811,"candidate_remote_delivery_latency_ms":1436.7622230000002,"candidate_prometheus_response_time_ms":22.699084052083336,"candidate_throughput_mb_per_sec":8.11709561051921,"latency_vs_baseline_percent":-71.33954429234645,"throughput_vs_baseline_percent":80.54042166562017},"status":"keep","description":"Parallelized deep JSON clones across fan-out child tasks.","timestamp":1788801574567,"segment":1,"confidence":null,"asi":{"hypothesis":"Move unavoidable deep JSON fan-out clones into parallel child tasks by sharing only multi-child records with Arc; keep single-child paths owned.","ownership_reason":"Each mutating receiver calls Arc::unwrap_or_clone, so branches retain independent Values while forwarding nodes share immutable input.","correctness":"The benchmark delivery oracle and healthy, retry, and restart smoke checks passed.","observed":"Throughput improved 5.29%, from 41,752 to 43,962 records/s. Median client latency also improved from 26.556 ms to 22.811 ms, the best observed value."}}
{"run":30,"commit":"df4890b","metric":44632.02715158129,"metrics":{"candidate_client_latency_ms":21.7185,"candidate_remote_delivery_latency_ms":1553.6100195,"candidate_prometheus_response_time_ms":23.711500343750007,"candidate_throughput_mb_per_sec":8.240857493267969,"latency_vs_baseline_percent":-75.3560122093749,"throughput_vs_baseline_percent":91.43523393818452},"status":"keep","description":"Reused immutable VRL context templates per function task.","timestamp":1788802689176,"segment":1,"confidence":4.29690986235091,"asi":{"hypothesis":"Combine parallel fan-out cloning with one reusable VRL metadata and secrets template per function task.","correctness_reason":"Each VRL call clones the complete initial context before execution, preserving per-record metadata and secret isolation, error labels, and fallback behavior.","correctness":"The benchmark delivery oracle and healthy, retry, and restart smoke checks passed.","observed":"Throughput improved to 44,632 records/s, 6.90% above the throughput-phase baseline. Median latency also improved to 21.719 ms, 75.36% below baseline branch latency. Throughput measured 91.44% above branch-v0.40.0."}}
{"run":31,"commit":"df4890b","metric":44695.723553955206,"metrics":{"candidate_client_latency_ms":25.787,"candidate_remote_delivery_latency_ms":1582.6971125,"candidate_prometheus_response_time_ms":25.225451005208328,"candidate_throughput_mb_per_sec":8.252618397002289,"latency_vs_baseline_percent":-68.6817224020355,"throughput_vs_baseline_percent":76.51289283623146},"status":"discard","description":"Gated VRL timers; the throughput result was noise and latency regressed.","timestamp":1788803800070,"segment":1,"confidence":7.848033063172909,"asi":{"hypothesis":"Skip per-record VRL Instant measurements when key-event timing logs are disabled.","rollback_reason":"Throughput changed only 0.14%, from 44,632 to 44,696 records/s, within noise, while median client latency regressed 18.73% from 21.719 to 25.787 ms.","next_action_hint":"Retain unconditional VRL timing because this branch does not deliver a meaningful throughput gain and worsens latency pacing.","correctness":"The benchmark oracle and healthy, retry, and restart smoke checks passed."}}
{"run":32,"commit":"df4890b","metric":44794.472433772826,"metrics":{"candidate_client_latency_ms":26.316499999999998,"candidate_remote_delivery_latency_ms":1596.2365049999999,"candidate_prometheus_response_time_ms":25.165558166666656,"candidate_throughput_mb_per_sec":8.270851390171815,"latency_vs_baseline_percent":-68.41552549777367,"throughput_vs_baseline_percent":94.77138480274955},"status":"discard","description":"Tried synchronous local-result sends; throughput was noise and latency regressed.","timestamp":1788804905221,"segment":1,"confidence":17.730062094669133,"asi":{"hypothesis":"Use result-channel `try_send` with awaited fallback to remove ready-future overhead for local pipeline outputs while preserving backpressure.","rollback_reason":"Throughput improved only 0.36%, from 44,632 to 44,794 records/s, within noise, while client latency regressed from 21.719 to 26.316 ms.","next_action_hint":"Awaited local-result sends provide beneficial task pacing; do not replace them for a marginal throughput result.","correctness":"The benchmark oracle and healthy, retry, and restart smoke checks passed."}}
{"run":33,"commit":"df4890b","metric":44883.69145965294,"metrics":{"candidate_client_latency_ms":24.5075,"candidate_remote_delivery_latency_ms":1609.3136975,"candidate_prometheus_response_time_ms":25.333179825520833,"candidate_throughput_mb_per_sec":8.287324791110319,"latency_vs_baseline_percent":-69.45839512480839,"throughput_vs_baseline_percent":85.94034410946072},"status":"discard","description":"Tried reusable VRL scratch contexts; the gain was noise and latency regressed.","timestamp":1788806215819,"segment":1,"confidence":16.438678906982744,"asi":{"hypothesis":"Reuse a mutable VRL context scratch object with `clone_from` to retain map allocations between records.","rollback_reason":"Throughput improved only 0.56%, from 44,632 to 44,884 records/s, within noise, while median latency regressed 12.84% to 24.508 ms.","next_action_hint":"The VRL Value and Secrets clone_from implementations do not reuse enough storage to justify mutable scratch state.","correctness":"The benchmark oracle and healthy, retry, and restart smoke checks passed."}}
{"run":34,"commit":"cd09793","metric":47420.041511504336,"metrics":{"candidate_client_latency_ms":23.040499999999998,"candidate_remote_delivery_latency_ms":1601.8943295,"candidate_prometheus_response_time_ms":23.63821336718751,"candidate_throughput_mb_per_sec":8.75563646468416,"latency_vs_baseline_percent":-73.90981870888112,"throughput_vs_baseline_percent":90.88616736050088},"status":"keep","description":"Avoided normal-path JSON clones before VRL on shared fan-out records.","timestamp":1788807442123,"segment":1,"confidence":30.15503779288708,"asi":{"hypothesis":"Apply VRL directly from shared fan-out records and clone the original serde JSON only on transform errors, eliminating normal-path branch deep clones.","correctness_reason":"Cow preserves owned-call behavior; borrowed calls retain the immutable Arc source, and error paths clone that exact original record before returning it.","correctness":"The benchmark delivery oracle and healthy, retry, and restart smoke checks passed.","observed":"Throughput improved 6.25%, from 44,632 to 47,420 records/s. Median client latency remained 73.91% below branch-v0.40.0 at 23.041 ms."}}
{"run":35,"commit":"081f344","metric":48928.15686073521,"metrics":{"candidate_client_latency_ms":23.3515,"candidate_remote_delivery_latency_ms":1702.4850185,"candidate_prometheus_response_time_ms":23.817967375000027,"candidate_throughput_mb_per_sec":9.03409488276615,"latency_vs_baseline_percent":-72.33578760936139,"throughput_vs_baseline_percent":95.61942297373291},"status":"keep","description":"Reused unchanged VRL context storage across function records.","timestamp":1788808594471,"segment":1,"confidence":15.567613489806654,"asi":{"hypothesis":"Keep one mutable VRL context scratch per function task and reset it only when a transform changed metadata or secrets.","correctness_reason":"Every record starts with the exact template; unchanged contexts require no reset, while changed contexts clone the template before the next record.","correctness":"The benchmark delivery oracle and healthy, retry, and restart smoke checks passed.","observed":"Throughput improved 3.18%, from 47,420 to 48,928 records/s, and reached 95.62% above branch-v0.40.0. Client latency remained 72.34% lower than baseline."}}
{"run":36,"commit":"081f344","metric":48475.454529341965,"metrics":{"candidate_client_latency_ms":21.0145,"candidate_remote_delivery_latency_ms":1589.216337,"candidate_prometheus_response_time_ms":20.956381809895827,"candidate_throughput_mb_per_sec":8.9505079242977,"latency_vs_baseline_percent":-76.01549927525481,"throughput_vs_baseline_percent":101.17433969992786},"status":"discard","description":"Confirmed more than twofold throughput and fourfold latency speed against branch-v0.40.0.","timestamp":1788809676633,"segment":1,"confidence":8.617764139066567,"asi":{"hypothesis":"Confirm the retained throughput gains and the twofold baseline target with a fresh isolated run.","rollback_reason":"The unchanged confirmation throughput of 48,475 records/s was 0.93% below the retained 48,928 records/s best, so it did not establish a new candidate-throughput win.","next_action_hint":"The target is now demonstrated: throughput was 101.17% above branch-v0.40.0, and client latency was 76.02% lower.","correctness":"The benchmark oracle and healthy, retry, and restart smoke checks passed.","target_result":{"throughput_vs_baseline_percent":101.17433969992786,"latency_vs_baseline_percent":-76.01549927525481,"baseline_to_candidate_latency_speedup":4.169362376695268}}}
{"run":37,"commit":"081f344","metric":48239.371188701494,"metrics":{"candidate_client_latency_ms":22.4,"candidate_remote_delivery_latency_ms":1693.9535285000002,"candidate_prometheus_response_time_ms":22.83890985677084,"candidate_throughput_mb_per_sec":8.906917496281844,"latency_vs_baseline_percent":-74.19399434341571,"throughput_vs_baseline_percent":99.03824502369731},"status":"discard","description":"Tried a 128-record accumulator; throughput regressed.","timestamp":1788810777436,"segment":1,"confidence":4.150184081165018,"asi":{"hypothesis":"Increase the bounded RemoteStream accumulator from 64 to 128 records, removing one growth step for 1,000-record requests without full-request preallocation.","rollback_reason":"Candidate throughput fell 1.41%, from 48,928 to 48,239 records/s; the smaller 64-record capacity remains better overall.","next_action_hint":"Retain 64 records as the allocation balance for mixed latency and throughput workloads.","correctness":"The benchmark oracle and healthy, retry, and restart smoke checks passed."}}
{"run":38,"commit":"3a4ae12","metric":48946.46437019523,"metrics":{"candidate_client_latency_ms":20.7275,"candidate_remote_delivery_latency_ms":1698.2206815,"candidate_prometheus_response_time_ms":20.207778317708332,"candidate_throughput_mb_per_sec":9.037475181312848,"latency_vs_baseline_percent":-74.70142741192338,"throughput_vs_baseline_percent":100.54298393150596},"status":"keep","description":"Borrowed the default RemoteStream batch key through routing.","timestamp":1788811909451,"segment":1,"confidence":2.8365966888538106,"asi":{"hypothesis":"Borrow the common `default` batch key through grouping and allocate only non-default keys, removing one small String allocation per RemoteStream branch and request.","correctness_reason":"Cow converts to owned only when mixed-key HashMap grouping requires ownership; routing comparisons and buffer keys remain byte-identical.","correctness":"The benchmark delivery oracle and healthy, retry, and restart smoke checks passed.","observed":"Candidate throughput reached 48,946 records/s and 100.54% above branch-v0.40.0. Median client latency improved to 20.728 ms, 74.70% below baseline."}}
{"run":39,"commit":"3a4ae12","metric":48567.20138629248,"metrics":{"candidate_client_latency_ms":21.196,"candidate_remote_delivery_latency_ms":1572.6245,"candidate_prometheus_response_time_ms":22.651331489583328,"candidate_throughput_mb_per_sec":8.967448063965044,"latency_vs_baseline_percent":-75.29027745395197,"throughput_vs_baseline_percent":103.63098839512219},"status":"discard","description":"Tried manual Arc fan-out construction; throughput regressed.","timestamp":1788813056772,"segment":1,"confidence":3.363825101727742,"asi":{"hypothesis":"Construct shared child items directly and move the final Arc into the last child, removing one reference-count increment and enum clone per fan-out.","rollback_reason":"Candidate throughput fell 0.77%, from 48,946 to 48,567 records/s; the longer manual fan-out loop did not improve the primary metric.","next_action_hint":"Keep the concise derived-clone fan-out implementation; compiler optimization and scheduling outweigh one Arc operation.","correctness":"The benchmark oracle and healthy, retry, and restart smoke checks passed.","target_result":"Despite the discard, this run remained 103.63% above branch-v0.40.0 throughput and 75.29% lower in latency."}}
