{"type":"config","name":"Realtime pipeline bulk ingestion fan-out latency and throughput","metricName":"candidate_client_latency_ms","metricUnit":"ms","bestDirection":"lower"}
{"run":1,"commit":"f5caeba","metric":0,"metrics":{},"status":"crash","description":"Baseline build failed because the local enterprise manifest overlay was absent or stale.","timestamp":1788771677641,"segment":0,"confidence":null,"asi":{"hypothesis":"Establish a fresh retained-branch baseline before changing code.","rollback_reason":"The candidate build used a Cargo manifest without enterprise workspace dependencies, causing 451 unresolved o2_enterprise, o2_openfga, and o2_dex errors.","next_action_hint":"Repair the documented local enterprise Cargo.toml/Cargo.lock build overlays, then rerun the unchanged baseline."}}
{"run":2,"commit":"295ca64","metric":35.605500000000006,"metrics":{"candidate_remote_delivery_latency_ms":1569.1503875,"candidate_prometheus_response_time_ms":38.40749522395836,"candidate_throughput_records_per_sec":40365.62782023288,"candidate_throughput_mb_per_sec":7.4531095207278,"latency_vs_baseline_percent":-57.5741146751823,"throughput_vs_baseline_percent":57.88748656455306},"status":"keep","description":"Established a valid fresh baseline after restoring the temporary enterprise build overlay.","timestamp":1788773070885,"segment":0,"confidence":null,"asi":{"hypothesis":"Repairing only the temporary enterprise manifest overlay restores valid black-box measurement without changing production behavior.","baseline_branch":"branch-v0.40.0","candidate_revision":"f5caebab8b","correctness":"Benchmark delivery oracle and healthy, retry, and restart smoke checks passed.","observed":"The retained candidate is 57.57% lower in median latency and 57.89% higher in throughput than the fresh behavioral baseline."}}
{"run":3,"commit":"295ca64","metric":37.5695,"metrics":{"candidate_remote_delivery_latency_ms":1365.0011045,"candidate_prometheus_response_time_ms":37.49709809635418,"candidate_throughput_records_per_sec":35203.64954826721,"candidate_throughput_mb_per_sec":6.5000018525920575,"latency_vs_baseline_percent":-58.95434333723002,"throughput_vs_baseline_percent":95.35137215861116},"status":"discard","description":"Tried allocation-free source-size byte counting; latency and candidate throughput regressed.","timestamp":1788774344948,"segment":0,"confidence":null,"asi":{"hypothesis":"Count serialized source bytes without allocating one temporary String per record while preserving exact usage-report byte counts.","rollback_reason":"Median candidate client latency regressed from 35.606 ms to 37.570 ms, and candidate throughput fell from 40,366 to 35,204 records/s despite black-box correctness passing.","next_action_hint":"Avoid source-size serialization micro-optimizations; profile or reduce the 12-way PipelineItem deep-clone and channel fan-out costs instead.","correctness":"The benchmark oracle and all healthy, retry, and restart smoke checks passed."}}
{"run":4,"commit":"9bbdbd9","metric":33.262,"metrics":{"candidate_remote_delivery_latency_ms":1725.436025,"candidate_prometheus_response_time_ms":33.629562273437486,"candidate_throughput_records_per_sec":40141.40270729777,"candidate_throughput_mb_per_sec":7.41170859587546,"latency_vs_baseline_percent":-59.146375165044375,"throughput_vs_baseline_percent":89.72334580377859},"status":"keep","description":"Shared immutable executable nodes across per-request pipeline tasks.","timestamp":1788775548102,"segment":0,"confidence":16.935845213849362,"asi":{"hypothesis":"Store immutable executable pipeline nodes behind Arc so each request clones 28 pointers instead of all node metadata, function parameters, remote settings, and child identifiers.","ownership_reason":"Executable nodes are immutable after pipeline construction and must be owned by independently spawned node tasks.","correctness":"The benchmark delivery oracle and healthy, retry, and restart smoke checks passed.","observed":"Median candidate latency improved 6.58%, from 35.606 ms to 33.262 ms; throughput remained within 1% at 40,141 records/s."}}
{"run":5,"commit":"9bbdbd9","metric":34.241,"metrics":{"candidate_remote_delivery_latency_ms":1509.5665804999999,"candidate_prometheus_response_time_ms":35.75715058072917,"candidate_throughput_records_per_sec":39645.74681691856,"candidate_throughput_mb_per_sec":7.320190692275843,"latency_vs_baseline_percent":-57.84789245617491,"throughput_vs_baseline_percent":69.52596170261494},"status":"discard","description":"Tried sharing compiled VRL resolvers; candidate latency regressed.","timestamp":1788776690985,"segment":0,"confidence":28.386601237465257,"asi":{"hypothesis":"Share compiled VRL result resolvers across spawned function-node tasks to avoid 14 resolver clones per request.","rollback_reason":"Median candidate latency regressed from 33.262 ms to 34.241 ms, while candidate throughput also fell from 40,141 to 39,646 records/s.","next_action_hint":"The resolver clone is likely already shallow or not material; target per-node task metadata allocations or request-local channel and map setup.","correctness":"The benchmark oracle and healthy, retry, and restart smoke checks passed."}}
{"run":6,"commit":"9bbdbd9","metric":0,"metrics":{"candidate_remote_delivery_latency_ms":0,"candidate_prometheus_response_time_ms":0,"candidate_throughput_records_per_sec":0,"candidate_throughput_mb_per_sec":0,"latency_vs_baseline_percent":0,"throughput_vs_baseline_percent":0},"status":"crash","description":"Shared task metadata strings, but the remote org conversion borrowed non-static data.","timestamp":1788776811598,"segment":0,"confidence":28.386601237465257,"asi":{"hypothesis":"Share four immutable task-label strings across 28 spawned nodes to remove about 108 allocations per request.","rollback_reason":"Compilation failed because converting `org_id.as_ref()` into the remote stream field selected a borrowed `'static` conversion.","next_action_hint":"Retain Arc sharing, but convert `org_id.to_string()` at the existing flush-only owned-field boundary."}}
{"run":7,"commit":"9bbdbd9","metric":36.17700000000001,"metrics":{"candidate_remote_delivery_latency_ms":1562.927988,"candidate_prometheus_response_time_ms":38.2434408671875,"candidate_throughput_records_per_sec":40010.80611851649,"candidate_throughput_mb_per_sec":7.3875952417228845,"latency_vs_baseline_percent":-57.899453043174674,"throughput_vs_baseline_percent":67.27296308186915},"status":"discard","description":"Tried sharing node-task label strings; latency regressed.","timestamp":1788777876501,"segment":0,"confidence":24.376694759985224,"asi":{"hypothesis":"Share pipeline ID, organization ID, pipeline name, and invocation ID across 28 spawned tasks to remove repeated String allocations.","rollback_reason":"Median candidate latency regressed from 33.262 ms to 36.177 ms; candidate throughput stayed effectively flat at 40,011 records/s.","next_action_hint":"Task-label allocation is not the limiting cost; optimize request-local graph setup or per-record execution rather than metadata.","correctness":"The benchmark oracle and healthy, retry, and restart smoke checks passed."}}
{"run":8,"commit":"9bbdbd9","metric":35.472,"metrics":{"candidate_remote_delivery_latency_ms":1566.7767575,"candidate_prometheus_response_time_ms":35.81454600260413,"candidate_throughput_records_per_sec":40765.580454526644,"candidate_throughput_mb_per_sec":7.526956775123799,"latency_vs_baseline_percent":-58.561957886743954,"throughput_vs_baseline_percent":62.16253169664013},"status":"discard","description":"Tried allocation-free request-local channel indexing; latency regressed.","timestamp":1788779001898,"segment":0,"confidence":34.36157024793376,"asi":{"hypothesis":"Borrow node identifiers for the sender map and keep receivers in execution order, removing 56 request-local String allocations and one HashMap.","rollback_reason":"Median candidate latency regressed from 33.262 ms to 35.472 ms; the 1.56% throughput increase was insufficient to offset the primary regression.","next_action_hint":"Channel-map setup is not material enough; investigate per-record fan-out cloning, VRL runtime initialization, or source-size accounting.","correctness":"The benchmark oracle and healthy, retry, and restart smoke checks passed."}}
{"run":9,"commit":"9bbdbd9","metric":34.776,"metrics":{"candidate_remote_delivery_latency_ms":1651.1042965000001,"candidate_prometheus_response_time_ms":35.54509424218753,"candidate_throughput_records_per_sec":39579.0477367199,"candidate_throughput_mb_per_sec":7.307875374107962,"latency_vs_baseline_percent":-61.96288822168627,"throughput_vs_baseline_percent":68.52971461572156},"status":"discard","description":"Tried borrowed VRL context strings; latency and throughput regressed.","timestamp":1788780197017,"segment":0,"confidence":47.18014184397127,"asi":{"hypothesis":"Pass borrowed organization and stream strings into VRL metadata and secrets conversion, avoiding temporary String clones per function and record.","rollback_reason":"Median candidate latency regressed from 33.262 ms to 34.776 ms, and candidate throughput fell from 40,141 to 39,579 records/s.","next_action_hint":"String conversion inside VRL context is not material; consider reusing complete metadata and secret templates per function task.","correctness":"The benchmark oracle and healthy, retry, and restart smoke checks passed."}}
{"run":10,"commit":"9bbdbd9","metric":36.778999999999996,"metrics":{"candidate_remote_delivery_latency_ms":1514.9813570000001,"candidate_prometheus_response_time_ms":40.96741935416665,"candidate_throughput_records_per_sec":35792.46989070322,"candidate_throughput_mb_per_sec":6.608721640619442,"latency_vs_baseline_percent":-56.48614274305659,"throughput_vs_baseline_percent":51.950885572815984},"status":"discard","description":"Tried synchronous source-channel injection; both latency and throughput regressed.","timestamp":1788781504023,"segment":0,"confidence":33.212181727409,"asi":{"hypothesis":"Use guaranteed-capacity `try_send` for the sole source producer, removing one async send per input record without changing bounded capacity.","rollback_reason":"Median candidate latency regressed from 33.262 ms to 36.779 ms, and candidate throughput fell 10.83% to 35,792 records/s.","next_action_hint":"Synchronous source injection may reduce useful scheduling overlap; keep awaited sends and target work inside node execution.","correctness":"The benchmark oracle and healthy, retry, and restart smoke checks passed."}}
{"run":11,"commit":"9bbdbd9","metric":40.639,"metrics":{"candidate_remote_delivery_latency_ms":1288.388515,"candidate_prometheus_response_time_ms":39.48478437239582,"candidate_throughput_records_per_sec":37756.64691374195,"candidate_throughput_mb_per_sec":6.971387286153313,"latency_vs_baseline_percent":-51.3745056864751,"throughput_vs_baseline_percent":53.413583167052295},"status":"discard","description":"Tried full-request RemoteStream preallocation; memory pressure regressed both primary metrics.","timestamp":1788783031657,"segment":0,"confidence":28.34426927993207,"asi":{"hypothesis":"Size each RemoteStream record accumulator from its channel capacity, avoiding growth from 50 to 100 or 1,600 slots.","rollback_reason":"Median client latency regressed 22.18% from 33.262 ms to 40.639 ms, and throughput fell 5.94% to 37,757 records/s.","next_action_hint":"Exact full-request preallocation increases concurrent memory pressure; keep the bounded 50-record initial capacity.","correctness":"The benchmark oracle and healthy, retry, and restart smoke checks passed."}}
{"run":12,"commit":"ed8b7bc","metric":28.570500000000003,"metrics":{"candidate_remote_delivery_latency_ms":1511.8062685,"candidate_prometheus_response_time_ms":29.9805628359375,"candidate_throughput_records_per_sec":39886.57076947861,"candidate_throughput_mb_per_sec":7.36465642687653,"latency_vs_baseline_percent":-66.59202525724976,"throughput_vs_baseline_percent":97.99142298128295},"status":"keep","description":"Bypassed empty RemoteStream buffers for batches that already meet the flush threshold.","timestamp":1788784250922,"segment":0,"confidence":22.514184397163152,"asi":{"hypothesis":"When an empty per-key buffer receives at least 50 records, write the existing request vector directly to WAL instead of serializing, appending, reallocating, and immediately taking it.","correctness_reason":"The fast path only fires when the buffer is empty and the record-count threshold already requires an immediate flush; it retains ordering, WAL acknowledgement, usage counts, retries, and restart recovery.","correctness":"The benchmark delivery oracle and healthy, retry, and restart smoke checks passed.","observed":"Median candidate latency improved 14.10%, from 33.262 ms to 28.571 ms. Candidate throughput remained within 1% at 39,887 records/s and measured 97.99% above baseline."}}
{"run":13,"commit":"ed8b7bc","metric":0,"metrics":{"candidate_remote_delivery_latency_ms":0,"candidate_prometheus_response_time_ms":0,"candidate_throughput_records_per_sec":0,"candidate_throughput_mb_per_sec":0,"latency_vs_baseline_percent":0,"throughput_vs_baseline_percent":0},"status":"crash","description":"Direct vacant-entry flushing exposed an unnecessarily borrowed shard lifetime.","timestamp":1788784389426,"segment":0,"confidence":22.514184397163152,"asi":{"hypothesis":"Keep no empty map entry after a direct threshold flush, avoiding persistent buffer allocation and key cloning on every large request.","rollback_reason":"Compilation failed because `batch_buffer_shard` used an elided return lifetime tied to the temporary buffer-key borrow, preventing the key from moving into `HashMap::entry`.","next_action_hint":"Declare the returned global shard mutex as `'static`, then rerun the same entry-based direct-flush experiment."}}
{"run":14,"commit":"945f1c1","metric":26.4195,"metrics":{"candidate_remote_delivery_latency_ms":1545.2218395,"candidate_prometheus_response_time_ms":25.548261351562516,"candidate_throughput_records_per_sec":41466.971450980185,"candidate_throughput_mb_per_sec":7.656461608708981,"latency_vs_baseline_percent":-69.50992215765814,"throughput_vs_baseline_percent":70.72817354727867},"status":"keep","description":"Avoided retaining empty RemoteStream buffer entries after direct threshold flushes.","timestamp":1788785508557,"segment":0,"confidence":20.213848508033742,"asi":{"hypothesis":"Do not insert or retain empty BatchBuffer entries when an incoming group already meets the direct flush threshold; move the key into one Entry lookup.","correctness_reason":"Removing an empty entry resets the next small batch timer exactly as a new buffer would; nonempty buffers still preserve accumulated records and ordering.","correctness":"The benchmark delivery oracle and healthy, retry, and restart smoke checks passed.","observed":"Median latency improved 7.53%, from 28.571 ms to 26.420 ms, and candidate throughput improved 3.96%, from 39,887 to 41,467 records/s."}}
{"run":15,"commit":"945f1c1","metric":29.613,"metrics":{"candidate_remote_delivery_latency_ms":1633.0310885,"candidate_prometheus_response_time_ms":30.364738247395852,"candidate_throughput_records_per_sec":40967.39022878685,"candidate_throughput_mb_per_sec":7.564218931843203,"latency_vs_baseline_percent":-63.52405000923817,"throughput_vs_baseline_percent":66.54106286729218},"status":"discard","description":"Tried a synchronous fast path for buffer-shard locks; latency regressed.","timestamp":1788786592299,"segment":0,"confidence":15.023883992038687,"asi":{"hypothesis":"Use Tokio mutex `try_lock` before awaiting because direct-flush shard critical sections are short and often uncontended.","rollback_reason":"Median candidate latency regressed from 26.420 ms to 29.613 ms, and throughput fell from 41,467 to 40,967 records/s.","next_action_hint":"The explicit fast-lock branch harms scheduling or code shape; retain normal async locking and optimize work before or after the buffer map.","correctness":"The benchmark oracle and healthy, retry, and restart smoke checks passed."}}
{"run":16,"commit":"991ec29","metric":25.2305,"metrics":{"candidate_remote_delivery_latency_ms":1421.657614,"candidate_prometheus_response_time_ms":27.718555414062497,"candidate_throughput_records_per_sec":41224.990492357734,"candidate_throughput_mb_per_sec":7.611782244508933,"latency_vs_baseline_percent":-69.69873477010286,"throughput_vs_baseline_percent":73.40622602170971},"status":"keep","description":"Grouped RemoteStream batch keys during record collection.","timestamp":1788787740933,"segment":0,"confidence":12.596355466799844,"asi":{"hypothesis":"Classify and group RemoteStream batch keys while receiving records, eliminating the second full-record scan for uniform keys and avoiding duplicate scans for mixed keys.","correctness_reason":"Each record uses the same post-transformation batch_key and default fallback as before; uniform and grouped vectors preserve the same records and routing groups.","correctness":"The benchmark delivery oracle and healthy, retry, and restart smoke checks passed.","observed":"Median latency improved 4.50%, from 26.420 ms to 25.231 ms. Throughput remained within 1% at 41,225 records/s, and remote delivery latency improved."}}
{"run":17,"commit":"0dab01e","metric":24.66,"metrics":{"candidate_remote_delivery_latency_ms":1607.5717650000001,"candidate_prometheus_response_time_ms":26.45252788802084,"candidate_throughput_records_per_sec":40989.79954491895,"candidate_throughput_mb_per_sec":7.568356587973835,"latency_vs_baseline_percent":-68.70717222476017,"throughput_vs_baseline_percent":67.83531147031702},"status":"keep","description":"Sized RemoteStream request accumulators to a bounded 64 records.","timestamp":1788788898046,"segment":0,"confidence":9.250679921222924,"asi":{"hypothesis":"Use a bounded 64-record RemoteStream accumulator, matching the production average and avoiding both the 50-to-100 latency reallocation and 1,600-slot throughput over-allocation.","correctness_reason":"Capacity changes allocation only; record order, thresholds, routing, and WAL contents stay unchanged.","correctness":"The benchmark delivery oracle and healthy, retry, and restart smoke checks passed.","observed":"Median client latency improved 2.26%, from 25.231 ms to 24.660 ms. Candidate throughput remained within 1% at 40,990 records/s."}}
{"run":18,"commit":"0dab01e","metric":0,"metrics":{"candidate_remote_delivery_latency_ms":0,"candidate_prometheus_response_time_ms":0,"candidate_throughput_records_per_sec":0,"candidate_throughput_mb_per_sec":0,"latency_vs_baseline_percent":0,"throughput_vs_baseline_percent":0},"status":"crash","description":"Allocation-free group iteration needed an ownership-safe Option iterator.","timestamp":1788789038262,"segment":0,"confidence":9.250679921222924,"asi":{"hypothesis":"Chain an optional uniform group with optional HashMap groups, removing the one-element Vec allocation per RemoteStream request.","rollback_reason":"Compilation failed because Iterator::map uses FnMut and cannot move the captured records vector, even though Option yields at most one item.","next_action_hint":"Use `uniform_batch_key.zip(Some(records)).into_iter()` before chaining grouped records, which moves both values without a closure."}}
{"run":19,"commit":"78f6af6","metric":23.189,"metrics":{"candidate_remote_delivery_latency_ms":1559.1826434999998,"candidate_prometheus_response_time_ms":23.773267002604165,"candidate_throughput_records_per_sec":41437.06797356831,"candidate_throughput_mb_per_sec":7.650940230639653,"latency_vs_baseline_percent":-71.53641262320637,"throughput_vs_baseline_percent":67.19461358724669},"status":"keep","description":"Iterated RemoteStream routing groups without an intermediate vector.","timestamp":1788790106616,"segment":0,"confidence":6.96680186270092,"asi":{"hypothesis":"Iterate one optional uniform group and optional grouped map directly, removing one heap-allocated Vec per RemoteStream node and request.","correctness_reason":"Option and HashMap iterators yield the same owned `(batch_key, records)` groups; the grouping count log remains unchanged.","correctness":"The benchmark delivery oracle and healthy, retry, and restart smoke checks passed.","observed":"Median client latency improved 5.97%, from 24.660 ms to 23.189 ms. Candidate throughput improved 1.09% to 41,437 records/s."}}
{"run":20,"commit":"78f6af6","metric":24.576,"metrics":{"candidate_remote_delivery_latency_ms":1469.8779465,"candidate_prometheus_response_time_ms":24.474641627604154,"candidate_throughput_records_per_sec":43807.848983304975,"candidate_throughput_mb_per_sec":8.08868123627743,"latency_vs_baseline_percent":-71.5179751060427,"throughput_vs_baseline_percent":75.55563534668492},"status":"discard","description":"Parallelized fan-out clones with shared JSON ownership; throughput improved, but latency regressed.","timestamp":1788791435010,"segment":0,"confidence":5.828944887827563,"asi":{"hypothesis":"Share JSON values only at multi-child fan-out, then deep-clone them concurrently in mutating child tasks instead of serially in the upstream task.","rollback_reason":"Candidate throughput improved 5.72% to 43,808 records/s, but primary median client latency regressed 5.98% from 23.189 ms to 24.576 ms.","next_action_hint":"The Arc fan-out is a throughput option but misses the dual-metric goal; seek clone reduction without atomic sharing or preserve one moved branch while parallelizing others.","correctness":"The benchmark oracle and healthy, retry, and restart smoke checks passed.","learned":"The serial fan-out clone is a measurable throughput cost, but Arc allocation and reference counting increase latency."}}
