{"run":77,"commit":"2d6ccf5","metric":51162.45870685952,"metrics":{"candidate_client_latency_ms":22.756,"candidate_remote_delivery_latency_ms":1705.4227620000001,"candidate_prometheus_response_time_ms":21.99935925520832,"candidate_throughput_mb_per_sec":9.446636375634542,"latency_vs_baseline_percent":-71.41188072789402,"throughput_vs_baseline_percent":108.12507041633084},"status":"discard","description":"Reduced channel capacity from 64 to 32; throughput within noise, 1.2% below best.","timestamp":1788885809329,"segment":2,"confidence":97.7116272902851,"asi":{"hypothesis":"Reduce per-node channel capacity from 64 to 32 to improve cache behavior and reduce per-request memory.","rollback_reason":"Throughput was 51,162 records/s, 1.2% below the retained best. Smaller channels didn't improve throughput; the try_send optimization already minimizes unnecessary yields regardless of capacity.","next_action_hint":"Keep capacity at 64; the try_send optimization already handles the scheduling efficiency. Try optimizing a different part of the pipeline.","correctness":"The benchmark oracle and healthy, retry, and restart smoke checks passed."}}
{"run":78,"commit":"2d6ccf5","metric":51168.93218926168,"metrics":{"candidate_client_latency_ms":24.971,"candidate_remote_delivery_latency_ms":1579.416559,"candidate_prometheus_response_time_ms":25.826724356770836,"candidate_throughput_mb_per_sec":9.447831639425276,"latency_vs_baseline_percent":-69.92061866846548,"throughput_vs_baseline_percent":106.89383672706265},"status":"discard","description":"Increased cooperative yield interval from 64 to 256 records; throughput within noise.","timestamp":1788886971301,"segment":2,"confidence":108.0242481322006,"asi":{"hypothesis":"Increase tokio::task::coop::consume_budget yield interval from every 64 records to every 256 in the ingest.rs input and result loops, reducing 30 yields to 7 per 1000-record request.","rollback_reason":"Throughput was 51,169 records/s, 1.2% below the retained best. The cooperative yield overhead is negligible; consume_budget is a fast no-op when budget remains.","next_action_hint":"The cooperative yield is not a bottleneck. The input and result loops are not on the critical throughput path compared to the pipeline execution. Look for optimizations inside the pipeline graph execution or WAL write path.","correctness":"The benchmark oracle and healthy, retry, and restart smoke checks passed."}}
{"run":79,"commit":"2d6ccf5","metric":49174.374544983366,"metrics":{"candidate_client_latency_ms":26.8065,"candidate_remote_delivery_latency_ms":1601.933907,"candidate_prometheus_response_time_ms":26.280365705729142,"candidate_throughput_mb_per_sec":9.079556515985729,"latency_vs_baseline_percent":-66.94575115446032,"throughput_vs_baseline_percent":97.84221983945059},"status":"discard","description":"Skipped pre-flatten for single-child function nodes; throughput regressed 5% because downstream nodes now run flatten_with_level instead of skipping via flattened flag.","timestamp":1788888107599,"segment":2,"confidence":88.3021922996146,"asi":{"hypothesis":"Skip the pre-flatten is_flat check for single-child function nodes since flatten_with_level already short-circuits for flat input.","rollback_reason":"Throughput fell 5% from 51,781 to 49,174 records/s. The is_flat check is cheaper than the downstream flatten_with_level call, even with its short-circuit. The flattened=true flag prevents downstream nodes from calling flatten_with_level at all, which is the bigger win.","next_action_hint":"Keep the pre-flatten for all function nodes. The is_flat check (10 comparisons) is cheaper than the flatten_with_level function call overhead + its internal flatness check.","correctness":"The benchmark oracle and healthy, retry, and restart smoke checks passed."}}
{"run":80,"commit":"38e6342","metric":54427.65207749327,"metrics":{"candidate_client_latency_ms":20.317500000000003,"candidate_remote_delivery_latency_ms":1693.0856815,"candidate_prometheus_response_time_ms":21.88347795572915,"candidate_throughput_mb_per_sec":10.049521679588358,"latency_vs_baseline_percent":-74.68287394706674,"throughput_vs_baseline_percent":126.10201265973578},"status":"keep","description":"VRL-native pipeline records: function nodes output vrl::value::Value directly, avoiding 14 redundant serde↔vrl conversions per record. Throughput jumped 5.1% to 54,428 records/s.","timestamp":1788889879544,"segment":2,"confidence":95.9934187032363,"asi":{"hypothesis":"Keep records in vrl::value::Value format between consecutive function nodes. Added VrlOwned/VrlShared variants to PipelineRecord and a new apply_vrl_fn_on_vrl function that operates directly on vrl values without serde_json round-trips. For the 14-function benchmark pipeline, this avoids ~14 redundant serde_json ↔ vrl::value conversions per record.","observed":"Throughput jumped 5.1% from 51,781 to 54,428 records/s — the largest single-experiment gain in segment 2. Latency also improved to 20.32 ms. Remote delivery latency stable at 1,693 ms.","correctness":"The benchmark delivery oracle and healthy, retry, and restart smoke checks all passed. The VRL conversion boundary moved but the actual VRL execution and output remain identical.","mechanism":"Each function node previously did 2 serde↔vrl conversions per record (1 in, 1 out). Now function-to-function edges carry vrl::value::Value natively — the into_vrl() call is free for VrlOwned records. Only boundary nodes (source, leaf, RemoteStream) convert between formats."}}
{"run":81,"commit":"0029035","metric":57242.546263801545,"metrics":{"candidate_client_latency_ms":19.471,"candidate_remote_delivery_latency_ms":1725.8059985,"candidate_prometheus_response_time_ms":20.103856703124993,"candidate_throughput_mb_per_sec":10.569263742148317,"latency_vs_baseline_percent":-76.01842557410566,"throughput_vs_baseline_percent":119.4568208990991},"status":"keep","description":"Added VRL-native flatness check to set flattened flag, preventing 12 downstream flatten_with_level calls. Throughput jumped 5.2% to 57,243 records/s.","timestamp":1788891001692,"segment":2,"confidence":90.82843377343981,"asi":{"hypothesis":"Add a VRL-native is_flat check (using vrl::value methods) in the function node to set flattened=true for flat VRL output. This prevents 12 downstream RemoteStream nodes from calling flatten_with_level on every record.","observed":"Throughput jumped 5.2% from 54,428 to 57,243 records/s. Client latency improved to 19.47 ms. This is the second consecutive major gain from the VRL-native pipeline change.","correctness":"The benchmark delivery oracle and healthy, retry, and restart smoke checks all passed.","mechanism":"The VRL-native flatness check scans BTreeMap values for nested objects/arrays. For flat records (the common case), this sets flattened=true, preventing 12 RemoteStream nodes from independently calling flatten_with_level. Non-flat records fall back to serde_json conversion + flatten_with_level."}}
{"run":82,"commit":"0029035","metric":55819.34615646054,"metrics":{"candidate_client_latency_ms":20.238,"candidate_remote_delivery_latency_ms":1697.8281495,"candidate_prometheus_response_time_ms":19.483060296874996,"candidate_throughput_mb_per_sec":10.306484074328875,"latency_vs_baseline_percent":-76.33812697299194,"throughput_vs_baseline_percent":131.09715729792666},"status":"discard","description":"Converted records to VRL at source feed; throughput fell 2.5%, serializing work that was previously pipelined.","timestamp":1788892200770,"segment":2,"confidence":82.18734797117627,"asi":{"hypothesis":"Convert records to VRL format in the source feed loop to save the first function node's into_vrl conversion.","rollback_reason":"Throughput fell 2.5% from 57,243 to 55,819 records/s. The source feed conversion serializes 1000 serde→vrl conversions on the caller task, which was previously pipelined with pipeline execution in common-01's task.","next_action_hint":"Keep the source feed sending Owned(serde_json). The first function node's into_vrl conversion overlaps with the feed loop via channel pipelining, which is beneficial.","correctness":"The benchmark oracle and healthy, retry, and restart smoke checks passed."}}
{"run":83,"commit":"0029035","metric":55941.036301683824,"metrics":{"candidate_client_latency_ms":23.551000000000002,"candidate_remote_delivery_latency_ms":1484.060043,"candidate_prometheus_response_time_ms":25.736848028645845,"candidate_throughput_mb_per_sec":10.328952942742902,"latency_vs_baseline_percent":-72.76727123455576,"throughput_vs_baseline_percent":130.53577338716934},"status":"discard","description":"Confirmation run: 55,941 records/s, 130.5% above baseline. Reproducible cluster is 55-57k.","timestamp":1788893302229,"segment":2,"confidence":76.65434892208694,"asi":{"hypothesis":"Confirm the retained VRL-native pipeline throughput is stable and reproducible.","rollback_reason":"The unchanged confirmation delivered 55,941 records/s, 2.3% below the recorded best of 57,243. This is within the expected variance range of 55-57k.","next_action_hint":"The reproducible throughput cluster is 55-57k records/s, 120-130% above baseline. Try a different structural optimization to break above the 57k ceiling."}}
{"run":84,"commit":"0029035","metric":54024.88536138802,"metrics":{"candidate_client_latency_ms":18.1685,"candidate_remote_delivery_latency_ms":1470.0103755,"candidate_prometheus_response_time_ms":17.85794265364584,"candidate_throughput_mb_per_sec":9.975154833126684,"latency_vs_baseline_percent":-78.0014408611264,"throughput_vs_baseline_percent":109.13987270399889},"status":"discard","description":"Direct VRL clone fan-out without Arc; throughput fell 5.6% — early cloning increases memory pressure vs deferred Arc::unwrap_or_clone.","timestamp":1788894396303,"segment":2,"confidence":86.29012003453971,"asi":{"hypothesis":"Skip Arc for VrlOwned fan-outs: clone VRL values directly for N-1 children, move to last child. Avoids Arc allocation + 13 atomic ops per record.","rollback_reason":"Throughput fell 5.6% from 57,243 to 54,025 records/s. The Arc-based sharing defers clones until each downstream node actually needs an owned copy. Direct cloning creates all 12 copies immediately in send_to_children, increasing memory pressure and reducing cache efficiency.","next_action_hint":"Keep Arc-based sharing (VrlShared) for fan-out. The deferred clone pattern via Arc::unwrap_or_clone is optimal because it spreads memory allocation across multiple tasks instead of front-loading it in the sending task.","correctness":"The benchmark oracle and healthy, retry, and restart smoke checks passed."}}
{"run":85,"commit":"0029035","metric":56493.91277736737,"metrics":{"candidate_client_latency_ms":22.2665,"candidate_remote_delivery_latency_ms":1605.261102,"candidate_prometheus_response_time_ms":22.66533390625,"candidate_throughput_mb_per_sec":10.431036055213111,"latency_vs_baseline_percent":-72.83032451329106,"throughput_vs_baseline_percent":126.65426234531638},"status":"discard","description":"Consuming serde→vrl conversion in into_vrl; throughput within noise, 1.3% below best.","timestamp":1788895767965,"segment":2,"confidence":74.67493688536015,"asi":{"hypothesis":"Switch into_vrl from borrowing From<&serde_json::Value> (which clones first) to consuming From<serde_json::Value>, reusing String buffers via Bytes::from(s) zero-copy.","rollback_reason":"Throughput was 56,494 records/s, 1.3% below the retained best. The consuming conversion affects only common-01 (which receives Owned from source) — 1000 records. The 10,000 String allocation savings (~50µs) is below the noise floor.","next_action_hint":"The serde→vrl conversion happens only at common-01 for 1000 records. The consuming version saves ~10 String allocs per record but this is negligible vs the total request time. Focus on reducing the VRL→serde conversion at the 12 RemoteStream boundaries.","correctness":"The benchmark oracle and healthy, retry, and restart smoke checks passed."}}
{"run":86,"commit":"0029035","metric":54780.56801231434,"metrics":{"candidate_client_latency_ms":21.0415,"candidate_remote_delivery_latency_ms":1646.3806455,"candidate_prometheus_response_time_ms":21.96741520052083,"candidate_throughput_mb_per_sec":10.114684077793719,"latency_vs_baseline_percent":-74.65810756288352,"throughput_vs_baseline_percent":136.48348373406756},"status":"discard","description":"Direct vrl_to_serde conversion + consuming into_vrl; throughput fell 4.3% — the serde trait dispatch is not the bottleneck.","timestamp":1788896923452,"segment":2,"confidence":63.63153149043482,"asi":{"hypothesis":"Replace VRL TryInto<serde_json::Value> (which uses serde_json::to_value for Objects) with a direct pattern-matching vrl_to_serde function, plus consuming From<serde_json::Value> in into_vrl.","rollback_reason":"Throughput fell 4.3% from 57,243 to 54,781 records/s. The serde trait dispatch overhead is negligible compared to the actual string/map conversion costs. The custom vrl_to_serde may also have worse branch prediction or cache behavior than the serde-optimized path.","next_action_hint":"Keep the VRL crate's TryInto for vrl→serde conversion. The serde path is already optimized and the overhead is in allocations, not dispatch. The 55-57k throughput cluster is the practical ceiling.","correctness":"The benchmark oracle and healthy, retry, and restart smoke checks passed."}}
