{"run":40,"commit":"07629b7","metric":49044.79799667694,"metrics":{"candidate_client_latency_ms":22.424999999999997,"candidate_remote_delivery_latency_ms":1656.627626,"candidate_prometheus_response_time_ms":22.177535453124996,"candidate_throughput_mb_per_sec":9.055631502106431,"latency_vs_baseline_percent":-73.62059534522612,"throughput_vs_baseline_percent":102.62929345978178},"status":"keep","description":"Confirmed the retained twofold throughput improvement in a second fresh run.","timestamp":1788814169135,"segment":1,"confidence":4.488633128651776,"asi":{"hypothesis":"Confirm that the retained twofold throughput result persists across a second fresh isolated benchmark.","correctness":"The benchmark delivery oracle and healthy, retry, and restart smoke checks passed.","observed":"The unchanged candidate delivered 49,045 records/s, 102.63% above branch-v0.40.0, with client latency 73.62% lower. This independently confirms both requested targets.","confidence":"Two consecutive retained-branch runs exceeded 100% throughput improvement, at 101.17% and 102.63%."}}
{"run":41,"commit":"24a35be","metric":49712.86625216286,"metrics":{"candidate_client_latency_ms":22.3335,"candidate_remote_delivery_latency_ms":1616.9610505,"candidate_prometheus_response_time_ms":22.44507509114584,"candidate_throughput_mb_per_sec":9.17898362479935,"latency_vs_baseline_percent":-72.65112690802887,"throughput_vs_baseline_percent":104.60641220783941},"status":"keep","description":"Preserved the baseline RemoteStream flush timer after direct batch writes.","timestamp":1788815615337,"segment":1,"confidence":5.139030137390587,"asi":{"hypothesis":"Restore the baseline empty-buffer timestamp after direct threshold flushes while retaining the zero-copy request-vector WAL path.","correctness_reason":"Keeping the empty BatchBuffer and resetting last_write preserves the baseline rule that a later small batch flushes immediately after five idle seconds.","correctness":"The benchmark delivery oracle and healthy, retry, and restart smoke checks passed.","observed":"The correctness fix also improved throughput to 49,713 records/s, 104.61% above branch-v0.40.0. Client latency remained 72.65% lower.","review_source":"A required scout review identified the stale-timer semantic difference."}}
{"run":42,"commit":"24a35be","metric":48261.29369018755,"metrics":{"candidate_client_latency_ms":24.878,"candidate_remote_delivery_latency_ms":1545.1115415,"candidate_prometheus_response_time_ms":25.76704782291668,"candidate_throughput_mb_per_sec":8.91096526695623,"latency_vs_baseline_percent":-70.37698554452145,"throughput_vs_baseline_percent":96.6229600124596},"status":"discard","description":"Measured retained throughput variance; this run landed below the twofold margin.","timestamp":1788817835074,"segment":1,"confidence":9.716484416941007,"asi":{"hypothesis":"Measure retained-branch variance after the timer-semantics correction and three above-target runs.","rollback_reason":"The unchanged candidate delivered 48,261 records/s, 2.92% below the retained best, and this run measured 96.62% above a stronger baseline.","next_action_hint":"The target margin remains close to host noise; seek another structural 3-5% throughput gain before finalizing.","correctness":"The benchmark oracle and healthy, retry, and restart smoke checks passed.","variance":"Recent unchanged or semantically equivalent retained runs span roughly 48.3k to 49.7k candidate records/s."}}
{"run":43,"commit":"24a35be","metric":49427.66593491479,"metrics":{"candidate_client_latency_ms":20.6035,"candidate_remote_delivery_latency_ms":1648.6994875,"candidate_prometheus_response_time_ms":21.156072445312482,"candidate_throughput_mb_per_sec":9.126324238222667,"latency_vs_baseline_percent":-74.21823187136333,"throughput_vs_baseline_percent":104.35425423549998},"status":"discard","description":"Tried simpler buffer-key formatting; throughput did not improve.","timestamp":1788819081338,"segment":1,"confidence":7.930770265585568,"asi":{"hypothesis":"Use captured format fields and a literal `remote` suffix for buffer keys, reducing formatting arguments in the 12-way hot path.","rollback_reason":"Candidate throughput fell 0.57%, from 49,713 to 49,428 records/s; the formatting change did not beat noise despite strong latency.","next_action_hint":"Keep the established buffer-key formatting; formatting is not the remaining bottleneck.","correctness":"The benchmark oracle and healthy, retry, and restart smoke checks passed."}}
{"run":44,"commit":"2ba5644","metric":49942.272039888296,"metrics":{"candidate_client_latency_ms":23.8185,"candidate_prometheus_response_time_ms":22.669109789062492,"candidate_remote_delivery_latency_ms":1565.406852,"candidate_throughput_mb_per_sec":9.221341109444975,"latency_vs_baseline_percent":-72.61596123224437,"throughput_vs_baseline_percent":102.87990863161215},"status":"keep","description":"Bounded per-request pipeline channels to 64 records; throughput reached 49,942 records/s, a marginal new best within noise.","timestamp":1788822396255,"segment":1,"confidence":7.022123396347023,"asi":{"correctness":"The benchmark delivery oracle and healthy, retry, and restart smoke checks passed.","hypothesis":"Bound all per-request pipeline channels to 64 records to reduce allocation and cache pressure while preserving asynchronous backpressure.","observed":"Candidate throughput improved 0.46% over the retained best, from 49,713 to 49,942 records/s, while remaining 102.88% above branch-v0.40.0. The gain is within recent run variance.","risk":"The smaller channel capacity changes task pacing but not record ownership, ordering, routing, or delivery cardinality."}}
{"run":45,"commit":"2ba5644","metric":46506.331322533275,"metrics":{"candidate_client_latency_ms":23.392,"candidate_prometheus_response_time_ms":23.752813614583353,"candidate_remote_delivery_latency_ms":1507.7185805,"candidate_throughput_mb_per_sec":8.586929015392544,"latency_vs_baseline_percent":-73.97375345605457,"throughput_vs_baseline_percent":129.44723638422371},"status":"discard","description":"Tried full-batch collector channels while bounding node channels; throughput regressed materially.","timestamp":1788842955551,"segment":1,"confidence":6.20516781517246,"asi":{"correctness":"The benchmark oracle and healthy, retry, and restart smoke checks passed.","hypothesis":"Retain full-batch result and error collector channels while bounding only the 28 node channels, avoiding collector backpressure while preserving most allocation savings.","next_action_hint":"Keep all pipeline channels bounded at 64; the uniform bound provides better task pacing than full-batch collector channels.","rollback_reason":"Candidate throughput fell 6.88%, from 49,942 to 46,506 records/s, despite latency remaining comparable."}}
{"run":46,"commit":"2ba5644","metric":48437.28219305704,"metrics":{"candidate_client_latency_ms":23.074,"candidate_prometheus_response_time_ms":22.9248190390625,"candidate_remote_delivery_latency_ms":1676.573879,"candidate_throughput_mb_per_sec":8.943459784126052,"latency_vs_baseline_percent":-73.57943973389364,"throughput_vs_baseline_percent":93.77808760685333},"status":"discard","description":"Rechecked the 64-record channel bound; the marginal throughput gain did not reproduce.","timestamp":1788844031051,"segment":1,"confidence":7.022123396347023,"asi":{"correctness":"The benchmark oracle and healthy, retry, and restart smoke checks passed.","hypothesis":"Re-measure the unchanged 64-record channel bound to distinguish a real throughput gain from host variance.","next_action_hint":"The bounded-channel gain did not reproduce; compare directly against the pre-channel retained commit before carrying this tuning into the finalized branch.","rollback_reason":"The unchanged confirmation delivered 48,437 records/s, 3.01% below run #44 and 2.57% below the pre-channel best of 49,713 records/s.","variance":"The confirmation remains within the recent retained-tree range, so the 64-record channel change lacks isolated evidence."}}
{"run":47,"commit":"2ba5644","metric":0,"metrics":{"candidate_client_latency_ms":0,"candidate_prometheus_response_time_ms":0,"candidate_remote_delivery_latency_ms":0,"candidate_throughput_mb_per_sec":0,"latency_vs_baseline_percent":0,"throughput_vs_baseline_percent":0},"status":"crash","description":"The pre-channel comparison did not compile because the revert omitted two channel arguments.","timestamp":1788844116862,"segment":1,"confidence":7.022123396347023,"asi":{"error":"Compilation failed because the exact revert removed channel_capacity before restoring the two collector-channel arguments.","hypothesis":"Measure the pre-channel retained implementation directly by removing the 64-record channel bound.","next_action_hint":"Restore all three channel constructors to batch_size in one edit, then rerun the same pre-channel comparison.","rollback_reason":"The partial revert left result and error channel constructors referencing an undefined channel_capacity local."}}
{"run":48,"commit":"2ba5644","metric":48405.91545215872,"metrics":{"candidate_client_latency_ms":22.816000000000003,"candidate_prometheus_response_time_ms":22.306715088541665,"candidate_remote_delivery_latency_ms":1403.3717649999999,"candidate_throughput_mb_per_sec":8.937668229086587,"latency_vs_baseline_percent":-73.2434254888739,"throughput_vs_baseline_percent":105.30180371271798},"status":"discard","description":"Measured the pre-channel implementation; throughput matched the bounded confirmation and did not improve the best.","timestamp":1788845222543,"segment":1,"confidence":8.159304831165054,"asi":{"comparison":"The pre-channel tree delivered 48,406 records/s, effectively equal to the bounded-channel confirmation at 48,437 records/s.","correctness":"The benchmark oracle and healthy, retry, and restart smoke checks passed.","hypothesis":"Measure the pre-channel retained implementation directly to isolate the effect of the 64-record channel bound.","next_action_hint":"Channel capacity is within host variance; stop tuning it and target a different structural cost.","rollback_reason":"Removing the channel bound did not beat the retained best of 49,942 records/s and offered no isolated throughput improvement."}}
{"run":49,"commit":"2ba5644","metric":48187.91978002793,"metrics":{"candidate_client_latency_ms":25.5225,"candidate_prometheus_response_time_ms":26.127870536458346,"candidate_remote_delivery_latency_ms":1551.473957,"candidate_throughput_mb_per_sec":8.897417508184356,"latency_vs_baseline_percent":-70.29486903438683,"throughput_vs_baseline_percent":100.85603068683831},"status":"discard","description":"Parallelized exact source-size counting; Rayon contention regressed throughput and latency.","timestamp":1788846450568,"segment":1,"confidence":9.735974581806275,"asi":{"correctness":"The benchmark oracle and healthy, retry, and restart smoke checks passed.","hypothesis":"Parallelize exact source-size serialization across records to use idle cores before pipeline task startup without changing usage accounting.","next_action_hint":"Keep sequential source-size serialization; Rayon scheduling contends with the already parallel bulk and pipeline work.","rollback_reason":"Candidate throughput fell 3.51%, from 49,942 to 48,188 records/s, and median client latency rose from 23.819 to 25.523 ms."}}
{"run":50,"commit":"2ba5644","metric":49147.51696638328,"metrics":{"candidate_client_latency_ms":22.3415,"candidate_prometheus_response_time_ms":23.568021843749996,"candidate_remote_delivery_latency_ms":1489.052166,"candidate_throughput_mb_per_sec":9.074597532673009,"latency_vs_baseline_percent":-74.91396201415907,"throughput_vs_baseline_percent":104.36881186301632},"status":"discard","description":"Tried a copy-on-write VRL target; correctness passed, but throughput did not beat the smaller scratch context.","timestamp":1788847629546,"segment":1,"confidence":9.482519482886541,"asi":{"correctness":"The benchmark oracle and healthy, retry, and restart smoke checks passed, including context-sensitive transformations in the existing scenarios.","hypothesis":"Use a copy-on-write VRL target so metadata and secrets clone only when a transform mutates them, eliminating every-record deep equality checks.","next_action_hint":"The lazy target adds virtual dispatch and branch overhead that offsets avoided context comparisons; retain the smaller scratch-and-reset implementation.","rollback_reason":"Candidate throughput reached 49,148 records/s but remained 1.59% below the retained best, so the additional target implementation is not justified."}}
{"run":51,"commit":"2ba5644","metric":47908.53867117655,"metrics":{"candidate_client_latency_ms":22.343,"candidate_prometheus_response_time_ms":20.664986953125013,"candidate_remote_delivery_latency_ms":1428.8173895,"candidate_throughput_mb_per_sec":8.84583258024604,"latency_vs_baseline_percent":-73.61649869222003,"throughput_vs_baseline_percent":122.33450739395535},"status":"discard","description":"Gated disabled node timers; reduced clock work again harmed concurrent fan-out throughput.","timestamp":1788848803054,"segment":1,"confidence":9.735974581806275,"asi":{"correctness":"The benchmark oracle and healthy, retry, and restart smoke checks passed.","hypothesis":"Skip per-record Instant clock reads when key-event timing is disabled while preserving identical timing logs when enabled.","next_action_hint":"Retain unconditional timing calls; they appear to provide beneficial task pacing in this highly concurrent fan-out workload.","rollback_reason":"Candidate throughput fell 4.07%, from 49,942 to 47,909 records/s, despite client latency remaining comparable."}}
{"run":52,"commit":"2ba5644","metric":40086.000103762606,"metrics":{"candidate_client_latency_ms":27.766,"candidate_prometheus_response_time_ms":27.004282606770833,"candidate_remote_delivery_latency_ms":1520.1630655,"candidate_throughput_mb_per_sec":7.401479059158728,"latency_vs_baseline_percent":-70.01641397779792,"throughput_vs_baseline_percent":61.08567259112024},"status":"discard","description":"Tried lazy fallback stream-name allocation; an anomalous run regressed throughput sharply.","timestamp":1788850033074,"segment":1,"confidence":9.482519482886541,"asi":{"correctness":"The benchmark oracle and healthy, retry, and restart smoke checks passed.","hypothesis":"Avoid eagerly allocating the unused fallback stream name for function nodes with a real stream name.","next_action_hint":"Do not infer causality from this anomalous run; the one-line allocation change is too small to explain the 20% drop, but it does not justify another noisy benchmark iteration.","rollback_reason":"Candidate throughput fell to 40,086 records/s, 19.74% below the retained best; the run also showed abnormal Prometheus throughput latency, so the change cannot be retained.","variance":"The result is an outlier relative to recent 48-50k records/s runs and likely reflects host contention."}}
{"run":53,"commit":"2ba5644","metric":48403.82166081426,"metrics":{"candidate_client_latency_ms":21.816,"candidate_prometheus_response_time_ms":21.25028024739582,"candidate_remote_delivery_latency_ms":1547.1231175,"candidate_throughput_mb_per_sec":8.937281631452745,"latency_vs_baseline_percent":-76.5466009449733,"throughput_vs_baseline_percent":100.32145825031824},"status":"discard","description":"Confirmed host recovery and a reproducible retained throughput near 48,404 records/s.","timestamp":1788851273648,"segment":1,"confidence":9.735974581806275,"asi":{"correctness":"The benchmark oracle and healthy, retry, and restart smoke checks passed.","hypothesis":"Re-measure the unchanged retained branch after an anomalous low-throughput run to verify host recovery and current variance.","next_action_hint":"Treat roughly 48.4k records/s as the reproducible bounded-channel result; avoid retaining micro-optimizations that only beat the 49.9k outlier.","rollback_reason":"The unchanged run recovered to 48,404 records/s but did not beat the recorded best.","variance":"Three controlled results now cluster at 48,406, 48,437, and 48,404 records/s, while run #44 at 49,942 records/s is an outlier."}}
{"run":54,"commit":"2ba5644","metric":49080.49171192461,"metrics":{"candidate_client_latency_ms":22.253999999999998,"candidate_prometheus_response_time_ms":23.171166432291667,"candidate_remote_delivery_latency_ms":1574.7474075,"candidate_throughput_mb_per_sec":9.06222198968976,"latency_vs_baseline_percent":-74.95611073598918,"throughput_vs_baseline_percent":120.19684074764511},"status":"discard","description":"Detected flat VRL results before fan-out; throughput improved over the reproducible cluster but not the recorded outlier.","timestamp":1788852426825,"segment":1,"confidence":10.48108618221129,"asi":{"correctness":"The benchmark oracle and healthy, retry, and restart smoke checks passed; nested outputs still follow the existing flatten path.","hypothesis":"Mark scalar-only VRL object results as already flat once in the function node, avoiding redundant flatten-map rebuilds in every downstream branch.","next_action_hint":"The result beat the reproducible 48.4k cluster by 1.4% but not the 49.9k outlier; repeat once before rejecting this general fast path.","rollback_reason":"Candidate throughput reached 49,080 records/s but remained 1.73% below the recorded best, so this run alone cannot retain the change."}}
{"run":55,"commit":"2ba5644","metric":49153.69442300831,"metrics":{"candidate_client_latency_ms":22.21,"candidate_prometheus_response_time_ms":23.00331612760417,"candidate_remote_delivery_latency_ms":1697.3241705,"candidate_throughput_mb_per_sec":9.075738138264255,"latency_vs_baseline_percent":-71.60953847923763,"throughput_vs_baseline_percent":108.47230219425899},"status":"discard","description":"Confirmed flat VRL result detection near 49,154 records/s, but it remained below the recorded best.","timestamp":1788853595945,"segment":1,"confidence":11.013125627144131,"asi":{"correctness":"The benchmark oracle and healthy, retry, and restart smoke checks passed twice; nested VRL outputs still use the existing flatten path.","hypothesis":"Repeat flat-result detection to determine whether its improvement over the reproducible retained cluster is stable.","next_action_hint":"Two runs clustered at 49.08-49.15k, about 1.5% above the 48.4k control cluster, but chasing the 49.9k outlier would overfit; leave this unretained for a broader workload study.","rollback_reason":"The confirmation reached 49,154 records/s but remained 1.58% below the recorded best, so the experiment policy requires discard.","variance":"The fast-path result reproduced closely across two runs, but its advantage is smaller than host-level peak variance."}}
{"run":56,"commit":"2ba5644","metric":49888.5054264351,"metrics":{"candidate_client_latency_ms":22.0095,"candidate_prometheus_response_time_ms":24.243239216145856,"candidate_remote_delivery_latency_ms":1455.721939,"candidate_throughput_mb_per_sec":9.211413641936977,"latency_vs_baseline_percent":-74.73381509691713,"throughput_vs_baseline_percent":120.25094354753922},"status":"discard","description":"Tested flat VRL detection on the clean pre-channel tree; it tied the peak but did not exceed it.","timestamp":1788854707569,"segment":1,"confidence":10.982971624849007,"asi":{"comparison":"On the pre-channel tree, flat-result detection reached 49,889 records/s, 3.07% above the matched pre-channel control at 48,406 records/s.","correctness":"The benchmark oracle and healthy, retry, and restart smoke checks passed.","hypothesis":"Measure flat VRL result detection on the clean pre-channel tree used by the finalized branch, removing the unconfirmed channel-capacity tuning.","next_action_hint":"The general flat fast path shows a repeatable 1.5-3.1% gain, but another run solely to cross the 49.9k peak would overfit; validate it later across mixed nested-output workloads.","rollback_reason":"Candidate throughput was effectively tied with but 0.11% below the recorded best, so the experiment policy requires discard."}}
{"run":57,"commit":"2ba5644","metric":49452.83650837852,"metrics":{"candidate_client_latency_ms":22.916,"candidate_prometheus_response_time_ms":23.329556869791684,"candidate_remote_delivery_latency_ms":1662.875931,"candidate_throughput_mb_per_sec":9.13097173290701,"latency_vs_baseline_percent":-74.76308732592906,"throughput_vs_baseline_percent":110.33907176630251},"status":"discard","description":"Skipped RemoteStream flattening for already-flat records; throughput improved over controls but stayed below the peak.","timestamp":1788855847368,"segment":1,"confidence":10.952982295347747,"asi":{"correctness":"The benchmark oracle and healthy, retry, and restart smoke checks passed; nested objects and arrays still use the existing flatten implementation.","hypothesis":"Check flatness at the RemoteStream boundary and skip rebuilding records that VRL already returned as scalar-only objects.","next_action_hint":"This simpler fast path repeatedly improves the 48.4k control cluster, but its sub-1% distance from the recorded peak remains inside host variance; validate with a mixed nested-output benchmark before retention.","rollback_reason":"Candidate throughput reached 49,453 records/s but remained 0.98% below the recorded best, so the experiment policy requires discard."}}
{"type":"config","name":"Realtime pipeline bulk ingestion throughput — continued","metricName":"candidate_throughput_records_per_sec","metricUnit":"","bestDirection":"higher"}
