{"run":58,"commit":"2ba5644","metric":0,"metrics":{},"status":"crash","description":"Benchmark timed out at 900s during candidate throughput trials.","timestamp":1788861836781,"segment":2,"confidence":null,"asi":{"hypothesis":"Replace allocating record.to_string() with non-allocating estimate_json_bytes and fix flush_all_buffers to release shard locks before WAL writes.","rollback_reason":"Timeout, not a code issue — the benchmark needs more time.","next_action_hint":"Increase timeout to 1200s."}}
{"run":59,"commit":"f06273f","metric":50808.62175567262,"metrics":{"candidate_client_latency_ms":22.897,"candidate_remote_delivery_latency_ms":1504.5839190000002,"candidate_prometheus_response_time_ms":22.415267088541675,"candidate_throughput_mb_per_sec":9.381303920967392,"latency_vs_baseline_percent":-73.07375699703655,"throughput_vs_baseline_percent":116.47835446015105},"status":"keep","description":"Established segment-2 baseline with estimate_json_bytes and lock-free flush_all_buffers; 50,809 records/s, 116.48% above branch-v0.40.0.","timestamp":1788862908238,"segment":2,"confidence":null,"asi":{"hypothesis":"Replace allocating record.to_string() with non-allocating estimate_json_bytes in process_batch and add_records; fix flush_all_buffers to release shard locks before async WAL writes.","correctness":"The benchmark delivery oracle and healthy, retry, and restart smoke checks passed.","observed":"Throughput reached 50,809 records/s, 116.48% above branch-v0.40.0, a new session best. Client latency was 22.897 ms, 73.07% below baseline."}}
{"run":60,"commit":"f06273f","metric":49896.05497901599,"metrics":{"candidate_client_latency_ms":22.3585,"candidate_remote_delivery_latency_ms":1645.6373050000002,"candidate_prometheus_response_time_ms":22.458029679687506,"candidate_throughput_mb_per_sec":9.212807591325513,"latency_vs_baseline_percent":-72.08014385434748,"throughput_vs_baseline_percent":103.26677829536825},"status":"discard","description":"Avoided cloning ExecutablePipeline in bulk.rs pipeline check; throughput did not improve.","timestamp":1788864198034,"segment":2,"confidence":null,"asi":{"hypothesis":"Add has_executable_pipeline to avoid a full ExecutablePipeline clone in bulk.rs just for an existence check.","rollback_reason":"Throughput fell 1.80% from 50,809 to 49,896 records/s; the pipeline check clone is not a measurable bottleneck because it happens once per stream per request.","next_action_hint":"The single-per-stream pipeline lookup is not hot enough. Focus on per-record or per-node work inside process_batch.","correctness":"The benchmark oracle and healthy, retry, and restart smoke checks passed."}}
{"run":61,"commit":"f06273f","metric":0,"metrics":{"candidate_client_latency_ms":0,"candidate_remote_delivery_latency_ms":0,"candidate_prometheus_response_time_ms":0,"candidate_throughput_mb_per_sec":0,"latency_vs_baseline_percent":0,"throughput_vs_baseline_percent":0},"status":"crash","description":"Benchmark timed out at 1200s; increase to 1500s.","timestamp":1788865571425,"segment":2,"confidence":null,"asi":{"hypothesis":"Bypass source node task by sending directly to its children.","rollback_reason":"Timeout, not a code issue.","next_action_hint":"Increase timeout to 1500s."}}
{"run":62,"commit":"f06273f","metric":49482.19327916645,"metrics":{"candidate_client_latency_ms":20.444000000000003,"candidate_remote_delivery_latency_ms":1493.848998,"candidate_prometheus_response_time_ms":21.316376947916645,"candidate_throughput_mb_per_sec":9.136392167065294,"latency_vs_baseline_percent":-77.67927329897807,"throughput_vs_baseline_percent":116.42127756330578},"status":"discard","description":"Bypassed source node task; throughput fell 2.6%, likely due to changed task scheduling.","timestamp":1788866750181,"segment":2,"confidence":122.76715089640803,"asi":{"hypothesis":"Skip the source node task and send records directly to its children, eliminating 1 task + 2000 channel ops per 1000-record request.","rollback_reason":"Throughput fell 2.6% from 50,809 to 49,482 records/s. The source node task likely provides beneficial scheduling overlap with the Tokio runtime.","next_action_hint":"Keep the source node task; it provides useful pacing. Focus on reducing per-record work inside function/RemoteStream nodes.","correctness":"The benchmark oracle and healthy, retry, and restart smoke checks passed."}}
{"run":63,"commit":"f06273f","metric":50090.68731097574,"metrics":{"candidate_client_latency_ms":20.290999999999997,"candidate_remote_delivery_latency_ms":1583.7336435,"candidate_prometheus_response_time_ms":21.00819744531249,"candidate_throughput_mb_per_sec":9.24874450509856,"latency_vs_baseline_percent":-76.03462937591534,"throughput_vs_baseline_percent":109.02010806740196},"status":"discard","description":"Wrapped VRL resolvers in Arc to avoid cloning compiled programs per-request; throughput within noise.","timestamp":1788867977593,"segment":2,"confidence":166.99792964147434,"asi":{"hypothesis":"Store VRL resolvers as Arc<(VRLResultResolver, bool)> so per-request task spawns clone only the Arc, not the compiled VRL program.","rollback_reason":"Throughput was 50,091 records/s, 1.4% below the baseline of 50,809; within noise and not an improvement.","next_action_hint":"The VRL resolver clone is not a measurable bottleneck because the ExecutablePipeline cache clone already uses Arc for nodes. Focus on per-record work, not per-request overhead.","correctness":"The benchmark oracle and healthy, retry, and restart smoke checks passed."}}
{"run":64,"commit":"f06273f","metric":50695.68323659086,"metrics":{"candidate_client_latency_ms":23.7305,"candidate_remote_delivery_latency_ms":1684.0954935,"candidate_prometheus_response_time_ms":22.66942923437501,"candidate_throughput_mb_per_sec":9.360450952804138,"latency_vs_baseline_percent":-69.57316134988204,"throughput_vs_baseline_percent":122.40132993027575},"status":"discard","description":"Replaced HashMap node lookups with precomputed indexed arrays; throughput effectively flat.","timestamp":1788869334336,"segment":2,"confidence":83.98175856145443,"asi":{"hypothesis":"Precompute indexed node arrays (sorted_exec_nodes, sorted_vrl, child_indices) during construction and use Vec indexing in process_batch instead of HashMap lookups.","rollback_reason":"Throughput was 50,696 records/s, 0.22% below the baseline. The HashMap operations are not a measurable bottleneck with only 28 nodes per request.","next_action_hint":"The per-request node setup overhead is negligible. Focus on improving the actual record processing: WAL write path, VRL conversion, or reducing channel contention.","correctness":"The benchmark oracle and healthy, retry, and restart smoke checks passed."}}
{"run":65,"commit":"f06273f","metric":17532.925793622955,"metrics":{"candidate_client_latency_ms":37.403000000000006,"candidate_remote_delivery_latency_ms":1635.4250794999998,"candidate_prometheus_response_time_ms":35.73285215885417,"candidate_throughput_mb_per_sec":3.2372794185345426,"latency_vs_baseline_percent":-56.5109208132038,"throughput_vs_baseline_percent":-25.29793098106779},"status":"discard","description":"First-record size sampling caused catastrophic throughput regression; something downstream depends on accurate source_size.","timestamp":1788870726664,"segment":2,"confidence":83.739665820576,"asi":{"hypothesis":"Estimate source_size from first record × count instead of traversing all records.","rollback_reason":"Throughput collapsed to 17,533 records/s, 65.5% below baseline. The first-record estimate likely inflated source_size, which affected usage reporting thresholds or other downstream behavior.","next_action_hint":"Keep the full estimate_json_bytes traversal. Do NOT sample source_size — the value must be accurate. Investigate whether usage reporting or another consumer has a threshold-sensitive path.","correctness":"The benchmark oracle passed but throughput regressed catastrophically."}}
{"run":66,"commit":"f06273f","metric":50329.28025977358,"metrics":{"candidate_client_latency_ms":22.697000000000003,"candidate_remote_delivery_latency_ms":1541.4647565,"candidate_prometheus_response_time_ms":21.402842385416662,"candidate_throughput_mb_per_sec":9.292798307164594,"latency_vs_baseline_percent":-73.7994643764141,"throughput_vs_baseline_percent":115.08396713782363},"status":"discard","description":"Confirmed retained baseline at 50,329 records/s; host is stable.","timestamp":1788871884097,"segment":2,"confidence":83.98175856145443,"asi":{"hypothesis":"Confirm the unchanged retained tree is stable after the anomalous run #65.","rollback_reason":"The unchanged code does not beat its own recorded best.","next_action_hint":"The reproducible cluster is 50.0-50.8k records/s. Target a structural throughput gain above 52k.","correctness":"The benchmark oracle and healthy, retry, and restart smoke checks passed.","variance":"Retained code reproduced at 50,329 records/s, confirming the 50k cluster."}}
{"run":67,"commit":"f06273f","metric":50505.55906797168,"metrics":{"candidate_client_latency_ms":23.5575,"candidate_remote_delivery_latency_ms":1597.08986,"candidate_prometheus_response_time_ms":24.245742390624994,"candidate_throughput_mb_per_sec":9.32534642631029,"latency_vs_baseline_percent":-73.27460534451168,"throughput_vs_baseline_percent":106.60306270129428},"status":"discard","description":"Merged source_size estimation into record feeding loop; throughput within noise.","timestamp":1788873111460,"segment":2,"confidence":127.0806059549874,"asi":{"hypothesis":"Merge the source_size estimation pass with the record feeding loop to avoid two sequential passes over all records.","rollback_reason":"Throughput was 50,506 records/s, 0.6% below the baseline. The two-pass overhead is negligible because the estimate_json_bytes call is non-allocating and cache-friendly.","next_action_hint":"The record iteration overhead is not a bottleneck. Try reducing actual per-record processing cost: VRL conversion path or RemoteStream record handling.","correctness":"The benchmark oracle and healthy, retry, and restart smoke checks passed."}}
{"run":68,"commit":"f06273f","metric":50535.413546986616,"metrics":{"candidate_client_latency_ms":18.9305,"candidate_remote_delivery_latency_ms":1560.4851995,"candidate_prometheus_response_time_ms":19.098421828125,"candidate_throughput_mb_per_sec":9.330858757315609,"latency_vs_baseline_percent":-85.84704294744554,"throughput_vs_baseline_percent":127.73095696278476},"status":"discard","description":"Try_send for source feed improved latency 17% but throughput stayed within noise.","timestamp":1788874747139,"segment":2,"confidence":138.66869258818713,"asi":{"hypothesis":"Use try_send with await fallback in the source feed loop to avoid unnecessary task yields when the channel has capacity.","rollback_reason":"Throughput was 50,535 records/s, 0.5% below the baseline of 50,809. Client latency improved significantly (18.93 ms vs 22.90 ms baseline), but throughput is the primary metric and did not improve.","next_action_hint":"The latency win suggests try_send helps pipelining, but it doesn't translate to throughput because the throughput bottleneck is downstream. Consider combining try_send with other downstream optimizations.","correctness":"The benchmark oracle and healthy, retry, and restart smoke checks passed.","latency_note":"The baseline ran with unusually high latency (133.757 ms), inflating the latency_vs_baseline_percent. The candidate latency of 18.93 ms is genuinely better than recent 22-23 ms results."}}
{"run":69,"commit":"fe9694c","metric":50896.273839257985,"metrics":{"candidate_client_latency_ms":20.8635,"candidate_remote_delivery_latency_ms":1595.3996045,"candidate_prometheus_response_time_ms":21.88237407552084,"candidate_throughput_mb_per_sec":9.397488001680594,"latency_vs_baseline_percent":-76.60150730098916,"throughput_vs_baseline_percent":118.28706936265074},"status":"keep","description":"Fixed pipeline_inputs capacity from destination count to actual record count; throughput matched best at 50,896 records/s.","timestamp":1788876038638,"segment":2,"confidence":141.78529590051164,"asi":{"hypothesis":"Pre-allocate pipeline_inputs and original_options vectors with the actual input record count instead of destination count (fixing a capacity bug that caused ~10 reallocations for 1000-record requests).","correctness":"The benchmark delivery oracle and healthy, retry, and restart smoke checks passed.","observed":"Throughput reached 50,896 records/s, matching the previous best. Client latency was 20.86 ms, 76.60% below baseline. The throughput improvement is within noise, but the capacity fix prevents reallocations.","variance":"The result is within the 50.0-50.9k reproducible cluster."}}
{"run":70,"commit":"fe9694c","metric":50332.308053732384,"metrics":{"candidate_client_latency_ms":21.274,"candidate_remote_delivery_latency_ms":1292.157458,"candidate_prometheus_response_time_ms":22.526883742187504,"candidate_throughput_mb_per_sec":9.293357359041147,"latency_vs_baseline_percent":-74.75585300155447,"throughput_vs_baseline_percent":105.64038125842539},"status":"discard","description":"Fused linear function chains (common-01 → common-02); throughput within noise, remote delivery latency improved 19%.","timestamp":1788877410946,"segment":2,"confidence":140.06535459819818,"asi":{"hypothesis":"Fuse sequential function → function chains into one task, eliminating 1 channel and 1 task per chain. For the benchmark, common-01 and common-02 are fused into a single task.","rollback_reason":"Throughput was 50,332 records/s, 1.1% below the baseline of 50,896. The channel and task overhead saved is apparently recouped by Tokio scheduler pipelining.","next_action_hint":"The pipelining of common-01 → common-02 through a channel provides beneficial scheduling overlap. Fusing them serializes the two VRL transforms on one task, reducing parallelism. Keep separate tasks.","correctness":"The benchmark oracle and healthy, retry, and restart smoke checks passed.","remote_delivery":"Remote delivery latency improved 19% (1292 ms vs 1595 ms), suggesting better scheduling for downstream WAL writes."}}
{"run":71,"commit":"fe9694c","metric":49363.4240919376,"metrics":{"candidate_client_latency_ms":19.85,"candidate_remote_delivery_latency_ms":1360.7547009999998,"candidate_prometheus_response_time_ms":20.264204825520828,"candidate_throughput_mb_per_sec":9.11446262433536,"latency_vs_baseline_percent":-78.01224003766166,"throughput_vs_baseline_percent":108.03814622769154},"status":"discard","description":"Skipped estimate_json_bytes for same-stream pipeline results; throughput fell 3%.","timestamp":1788878581790,"segment":2,"confidence":127.29983803628278,"asi":{"hypothesis":"Skip per-record estimate_json_bytes in pipeline result handling when destination stream matches source stream.","rollback_reason":"Throughput fell 3% from 50,896 to 49,363 records/s. The result handling path is not the throughput bottleneck; it runs after pipeline execution completes.","next_action_hint":"The pipeline execution path (VRL + channel scheduling) is the remaining bottleneck. The result handling overhead is negligible compared to the pipeline work.","correctness":"The benchmark oracle and healthy, retry, and restart smoke checks passed."}}
{"run":72,"commit":"fe9694c","metric":49969.23862439508,"metrics":{"candidate_client_latency_ms":25.442,"candidate_remote_delivery_latency_ms":1575.6253419999998,"candidate_prometheus_response_time_ms":25.218067268229188,"candidate_throughput_mb_per_sec":9.226320219608308,"latency_vs_baseline_percent":-70.86699377651566,"throughput_vs_baseline_percent":116.41858761484811},"status":"discard","description":"Confirmed retained state: 49,969 records/s, 116.42% above baseline. Both targets exceeded.","timestamp":1788879705606,"segment":2,"confidence":138.9079157635738,"asi":{"hypothesis":"Final confirmation run of the retained state.","rollback_reason":"Unchanged code; confirmation only. The result was 1.8% below the recorded best.","next_action_hint":"The retained throughput reproducibly exceeds the 100% improvement target. Multiple confirmed runs range from 49.4-50.9k records/s, all above 100% baseline improvement.","correctness":"The benchmark oracle and healthy, retry, and restart smoke checks passed.","final_status":{"throughput_improvement_percent":116.42,"latency_improvement_percent":70.87,"candidate_throughput_records_per_sec":49969,"candidate_client_latency_ms":25.44,"confirmed_runs_above_100_percent":5}}}
{"run":73,"commit":"fe9694c","metric":49635.81951046077,"metrics":{"candidate_client_latency_ms":24.9335,"candidate_remote_delivery_latency_ms":1241.1474355,"candidate_prometheus_response_time_ms":24.333090671875016,"candidate_throughput_mb_per_sec":9.164757714411477,"latency_vs_baseline_percent":-68.53042704514046,"throughput_vs_baseline_percent":98.72517036378241},"status":"discard","description":"Borrowed destination key lookup in pipeline result loop; throughput within noise, 2.5% below best.","timestamp":1788881195087,"segment":2,"confidence":125.49486082938122,"asi":{"hypothesis":"Replace entry(destination_stream.clone()) with get_mut(borrowed) + fallback insert to avoid 999 String allocations per 1000-record pipeline result group.","rollback_reason":"Throughput was 49,636 records/s, 2.5% below the retained best. Only 1,000 records pass through this path per request (the local output), so 999 avoided String allocs are negligible vs VRL conversion cost.","next_action_hint":"The pipeline result handling path is not on the critical throughput path. Focus on the pipeline execution itself (VRL + channel scheduling) or the RemoteStream WAL path.","correctness":"The benchmark oracle and healthy, retry, and restart smoke checks passed."}}
{"run":74,"commit":"fe9694c","metric":48641.23003942524,"metrics":{"candidate_client_latency_ms":20.34,"candidate_remote_delivery_latency_ms":1693.3942795,"candidate_prometheus_response_time_ms":21.245018716145804,"candidate_throughput_mb_per_sec":8.981116714479475,"latency_vs_baseline_percent":-76.1109186256144,"throughput_vs_baseline_percent":101.29280363641836},"status":"discard","description":"Increased BATCH_BUFFER_SHARDS from 16 to 64; throughput fell 4.4%, extra shards add overhead without reducing contention.","timestamp":1788882475284,"segment":2,"confidence":111.89245266786675,"asi":{"hypothesis":"Increase batch buffer shards from 16 to 64 to reduce shard mutex contention across 8 callers × 12 destinations.","rollback_reason":"Throughput fell 4.4% from 50,896 to 48,641 records/s. The 16-shard configuration is already well-sized; 64 shards add memory and hashing overhead without reducing contention because the bypass path holds the lock only briefly.","next_action_hint":"Keep 16 shards. The shard lock is not contended in the benchmark because the empty-buffer bypass holds the lock for <1µs before dropping.","correctness":"The benchmark oracle and healthy, retry, and restart smoke checks passed."}}
{"run":75,"commit":"2d6ccf5","metric":51780.50469305808,"metrics":{"candidate_client_latency_ms":22.86,"candidate_remote_delivery_latency_ms":1293.3951714999998,"candidate_prometheus_response_time_ms":23.350107231770846,"candidate_throughput_mb_per_sec":9.560752386526243,"latency_vs_baseline_percent":-74.09455600380763,"throughput_vs_baseline_percent":114.86327348026953},"status":"keep","description":"try_send in send_to_children avoids unnecessary scheduler yields during fan-out; new throughput best at 51,781 records/s.","timestamp":1788883586323,"segment":2,"confidence":97.7116272902851,"asi":{"hypothesis":"Replace send().await with try_send()+await-fallback in send_to_children for both single-child and multi-child paths. For the 13-way fan-out at common-02, this avoids ~13,000 unnecessary task yields per 1000-record request when channels have capacity.","correctness":"The benchmark delivery oracle and healthy, retry, and restart smoke checks passed.","observed":"Throughput improved 1.7% from 50,896 to 51,781 records/s — the first improvement above the 50.9k cluster in segment 2. Remote delivery latency also improved to 1,293 ms from 1,595 ms baseline.","reasoning":"The 13-way fan-out at common-02 sends 13 items per record. With capacity-64 channels and fast branch consumers, channels rarely fill. try_send completes synchronously, keeping the common-02 task on-CPU instead of yielding to the scheduler after each send."}}
{"run":76,"commit":"2d6ccf5","metric":50010.247724886925,"metrics":{"candidate_client_latency_ms":23.323999999999998,"candidate_remote_delivery_latency_ms":1553.7373010000001,"candidate_prometheus_response_time_ms":22.95448640885416,"candidate_throughput_mb_per_sec":9.233892139923123,"latency_vs_baseline_percent":-71.67595662258492,"throughput_vs_baseline_percent":106.3084283008142},"status":"discard","description":"Extended try_send to source feed and leaf result sender; throughput regressed 3.4% vs send_to_children-only try_send.","timestamp":1788884709519,"segment":2,"confidence":113.83638198710858,"asi":{"hypothesis":"Extend try_send with await-fallback to the source feed loop and leaf result sender in addition to send_to_children.","rollback_reason":"Throughput fell 3.4% from 51,781 to 50,010 records/s. The awaited source and result sends provide beneficial scheduling backpressure that try_send disrupts. Only the multi-child fan-out benefits from try_send.","next_action_hint":"Keep try_send only in send_to_children where it avoids 13k unnecessary yields per request. The source feed and result collector channels benefit from scheduled sends.","correctness":"The benchmark oracle and healthy, retry, and restart smoke checks passed."}}
